{
  "$schema": "https://json-schema.org/draft/2020-12/schema",
  "type": "object",
  "required": ["architecture_overview", "components", "data_models", "api_endpoints", "tech_stack", "risks"],
  "additionalProperties": false,
  "properties": {
    "architecture_overview": { "type": "string", "minLength": 1 },
    "components": {
      "type": "array", "minItems": 1,
      "items": {
        "type": "object",
        "required": ["name", "description"],
        "properties": {
          "name": { "type": "string" },
          "description": { "type": "string" }
        }
      }
    },
    "data_models": {
      "type": "array", "minItems": 1,
      "items": {
        "type": "object",
        "required": ["name", "description"],
        "properties": {
          "name": { "type": "string" },
          "description": { "type": "string" }
        }
      }
    },
    "api_endpoints": {
      "type": "array", "minItems": 1,
      "items": {
        "type": "object",
        "required": ["method", "path", "description"],
        "properties": {
          "method": { "type": "string" },
          "path": { "type": "string" },
          "description": { "type": "string" }
        }
      }
    },
    "tech_stack": { "type": "object" },
    "risks": {
      "type": "array",
      "items": {
        "type": "object",
        "required": ["risk", "mitigation"],
        "properties": {
          "risk": { "type": "string" },
          "mitigation": { "type": "string" }
        }
      }
    }
  }
}
